<?xml version="1.0" encoding="UTF-8"?>
<exo xmlns:xsi="http://www.w3.org/2001/XMLSchema-instance"
	xsi:noNamespaceSchemaLocation="qcm.xsd">
	<theme>Polynômes</theme>
	<niveau>Première année</niveau>
	<enonce>Pour $n\in\dN$, on pose $P_n = \sum_{k=0}^n\frac{X^k}{k!}$.</enonce>
	<reponse value="false">$\forall n \in \dN \setminus \{0, 1, 2\}$, $P_n$ possède au moins une racine multiple car $P'_n = P_{n-1}$.</reponse>
	<reponse value="true">$\forall n \in \dN$, $P_n$ est l'unique polynôme vérifiant $P_{n}-P'_{n} = \frac{X^n}{n!}$.</reponse>
	<reponse value="false">$\forall n \in \dN$, $nX^{n+2}-(n+2)X^{n+1}+(n+2)X-n$ admet $1$ comme racine double.</reponse>
	<reponse value="true">Si $m$ est divisible par $n$ alors $\forall a \in \dC, X^m-a^m$ est divisible par $X^n-a^n$.</reponse>
</exo>
